basicName,subTitleName,rating,openDate,openTime,address,price,label,review,url,img,monOpen,monClose,tuesOpen,tuesClose,wedOpen,wedClose,thursOpen,thursClose,friOpen,friClose,satOpen,satClose,sunOpen,sunClose,recommend
"Former Residence of Kinoshita Seigai, Tamsui",淡水木下靜涯舊居, 5,"['Saturday-Sunday', 'Monday-Friday']","['9:30-18:00', '9:30-17:00']","No. 2巷2號, Sanmin St, Tamsui District, New Taipei City, Taiwan 251",0.0,,"The former residence of Muxia Jingya - the residence of Muxia Jingya in Freshwater, located on the third floor and 26th floor, is an ancient brick-built two-story building with an excellent view of the Vale and Guanyin Mountain. The building on the second floor uses two structural systems of ""brick columns, wooden beams"" and ""weight-bearing walls"". The former is used in the corridors on both sides of the first and second sides, and the latter is used in the rectangular volume of the enclosed interior space. The four brick columns on the west side of the former residence support the corridor and the roof, all of which are made of red bricks and white and gray brushed branches to make arc angles and face decoration. part 2",https://www.trip.com/travel-guide/attraction/new-taipei-city/former-residence-of-kinoshita-seigai-tamsui-133995658?curr=USD&locale=en-US,https://ak-d.tripcdn.com/images/0107312000dovepg28FAB_C_180_240_Q70.webp?proc=source%2ftrip,570.0,1020.0,570.0,1020.0,570.0,1020.0,570.0,1020.0,570.0,1020.0,570.0,1080.0,570.0,1080.0,
Jinshan Shitoushan Park,獅頭山公園,,['Open daily'],['Open all day'],208台灣新北市金山區磺港路171-2號,0.0,,,https://www.trip.com/travel-guide/attraction/new-taipei-city/jinshan-shitoushan-park-133903208?curr=USD&locale=en-US,https://ak-d.tripcdn.com/images/fd/tg/g1/M07/FC/25/CghzflW7IASANUuCAAAtJkkq6KA204_C_180_240_Q70.webp?proc=source%2ftrip,0.0,1440.0,0.0,1440.0,0.0,1440.0,0.0,1440.0,0.0,1440.0,0.0,1440.0,0.0,1440.0,
Jilin Park,吉林公園, 5,['Open daily'],['Open all day'],"Jilin Rd, Luzhu District, Taoyuan City, Taiwan 338",0.0,,so nice place 🥰🥰🥰🥰🥰🥰🥰❤️❤️❤️❤️❤️🥰❤️❤️,https://www.trip.com/travel-guide/attraction/taoyuan/jilin-park-138492780?curr=USD&locale=en-US,https://ak-d.tripcdn.com/images/fd/tg/g2/M02/C5/07/Cghzf1W7H_mAOouUAAA0-J5t66I153_C_180_240_Q70.webp?proc=source%2ftrip,0.0,1440.0,0.0,1440.0,0.0,1440.0,0.0,1440.0,0.0,1440.0,0.0,1440.0,0.0,1440.0,
Lion's Head Mountain Park Trail,獅頭山公園步道,,['Open daily'],['Open all day'],"No. 208號, Minsheng Rd, Jinshan District, New Taipei City, Taiwan 208",0.0,,,https://www.trip.com/travel-guide/attraction/new-taipei-city/lion-s-head-mountain-park-trail-137075413?curr=USD&locale=en-US,https://ak-d.tripcdn.com/images/0103k12000chukowo524C_C_180_240_Q70.webp?proc=source%2ftrip,0.0,1440.0,0.0,1440.0,0.0,1440.0,0.0,1440.0,0.0,1440.0,0.0,1440.0,0.0,1440.0,
Guixi Riverside Park,檜溪（會稽）河濱公園, 4,['Open daily'],['Open all day'],"330, Taiwan, Taoyuan City, Taoyuan District",0.0,,The wind and the sun went to the riverside park to play very beautiful and very happy.,https://www.trip.com/travel-guide/attraction/taoyuan/guixi-riverside-park-137324345?curr=USD&locale=en-US,https://ak-d.tripcdn.com/images/fd/tg/g2/M02/C5/07/Cghzf1W7H_mAOouUAAA0-J5t66I153_C_180_240_Q70.webp?proc=source%2ftrip,0.0,1440.0,0.0,1440.0,0.0,1440.0,0.0,1440.0,0.0,1440.0,0.0,1440.0,0.0,1440.0,
Shiqiuling Tunnel,獅球嶺隧道, 4.4,['Open daily'],['Open all day'],"Keerung City, Anle District, Chongde Road, No. 127",0.0,,"Shiqiuling - Taiwan is located in the northeast corner of Taiwan, also the midpoint of the Japanese and Philippine routes, and ships must be transported here. Therefore, since the 17th century, the Spanish and Dutch colonists, the Ming and Zheng Dynasty, the Qing Dynasty, and Japan have realized the importance of Lion Ball Ridge and built defenses against it. After the Pacific War of World War II, Xingtai gradually became desolate and lost its military function. At present, there are only many relics such as stone command post, scorpion and ammunition depots. On August 19, 1985, Lionqiuling Xingtai was designated as a second-level monument.",https://www.trip.com/travel-guide/attraction/keelung/shiqiuling-tunnel-30142760?curr=USD&locale=en-US,https://ak-d.tripcdn.com/images/100s090000003qccrA8EA_C_180_240_Q70.webp?proc=source%2ftrip,0.0,1440.0,0.0,1440.0,0.0,1440.0,0.0,1440.0,0.0,1440.0,0.0,1440.0,0.0,1440.0,2.0
Beiguan Tidal Park,北關海潮公園, 4.3,['Open daily'],['Open all day'],"No. 10, Section 4, Binhai Road, Toucheng Township, Yilan County, Taiwan 261",0.0,,"The homestay we stayed in was not far from Beiguan Sea Trend Park. The most suitable thing for Beiguan Sea Trend Park is to see the sea and the rocks of different shapes on the seaside. It is very interesting. Because it is close, the scenery is very beautiful when you go to see it at dusk in the morning.",https://www.trip.com/travel-guide/attraction/yilan/beiguan-tidal-park-87624?curr=USD&locale=en-US,https://ak-d.tripcdn.com/images/0100x120008iwq8fqF79C_C_180_240_Q70.webp?proc=source%2ftrip,0.0,1440.0,0.0,1440.0,0.0,1440.0,0.0,1440.0,0.0,1440.0,0.0,1440.0,0.0,1440.0,2.0
Wu Dengyi Art Museum,巫登益美術館（新北館）, 5,['Monday-Friday'],['10:00-17:00'],251台灣新北市淡水區真理街巫登益當代藝術園區,0.0,,"Wu Dengyi Art Museum - Famous as Taiwan's contemporary ink art master Wu Dengyi (1951 –). In 2020, Wu Dengyi Art Museum (Taipei Museum) was founded in Taipei 101 Building and is located on the 32nd floor, which is the highest art museum in Taiwan. This year (2021～ 2023) in Freshwater established Wudengyi Contemporary Art Park - Wudengyi Art Museum Xinbei Hall, which will renovate the century-old historical buildings of the Qing Dynasty and become a contemporary art hall full of historical and cultural heritage. Open to the public with the appearance of the Wudengyi Contemporary Art Park, to create the oldest art museum in Taiwan. part 3",https://www.trip.com/travel-guide/attraction/new-taipei-city/city-138948554?curr=USD&locale=en-US,https://ak-d.tripcdn.com/images/01050224x8ty6ln4243BA_C_180_240_Q70.webp?proc=source%2ftrip,600.0,1020.0,600.0,1020.0,600.0,1020.0,600.0,1020.0,600.0,1020.0,0.0,0.0,0.0,0.0,
Yuan Kuang Ch'an Monastery,圓光禪寺, 4,['Open daily'],['8:00-17:00'],"No. 11號, Lane 888, Section 1, Shengde Rd, Zhongli District, Taoyuan City, Taiwan 320",0.0,,"Yuanguang Temple is located in Taoyuan, except for the Buddha Hall, built like a garden in the south of the Yangtze River. Buddhism in Taiwan is very popular, the Buddhists are very religious, and the monks are not greedy. You don't need to buy tickets to enter the temple, ask for a sign to burn incense, and decide whether to pay the merit fee according to your ability. The temple does not set up a company and hosts improper Buddhist CEOs. The famous monks also preach on TV programs, generally persuade people to be good, many temples also provide free Buddhist publications. Amitabha!",https://www.trip.com/travel-guide/attraction/taoyuan/yuan-kuang-ch-an-monastery-18043020?curr=USD&locale=en-US,https://ak-d.tripcdn.com/images/100e0i0000009devb14FB_C_180_240_Q70.webp?proc=source%2ftrip,480.0,1020.0,480.0,1020.0,480.0,1020.0,480.0,1020.0,480.0,1020.0,480.0,1020.0,480.0,1020.0,1.5
Regional Exploration Building,區域探索館, 4,['Tuesday-Sunday'],['9:00-17:00'],"No. 367號, Beining Rd, Zhongzheng District, Keelung City, Taiwan 202",150.29999999999998,,"It is a bit inconvenient to divide many museums, and it is not in the same building. The aquarium can be seen is a bit small, there are not many types, and it is a little disappointing. But the scenery next to the museum is not bad, but you can see the scenery outside the museum and blow the sea breeze.",https://www.trip.com/travel-guide/attraction/keelung/regional-exploration-building-39522324?curr=USD&locale=en-US,https://ak-d.tripcdn.com/images/0103f12000brrrrgl17ED_C_180_240_Q70.webp?proc=source%2ftrip,0.0,0.0,540.0,1020.0,540.0,1020.0,540.0,1020.0,540.0,1020.0,540.0,1020.0,540.0,1020.0,
dong fang gao er fu ju le bu,東方高爾夫俱樂部,,"['Monday-Friday,Sunday']",['6:00-19:00'],333台灣桃園市龜山區東方球場路100號,0.0,,,https://www.trip.com/travel-guide/attraction/taoyuan/city-144871409?curr=USD&locale=en-US,https://ak-d.tripcdn.com/images/0102u1200086k28vc0A5C_C_180_240_Q70.webp?proc=source%2ftrip,360.0,1140.0,360.0,1140.0,360.0,1140.0,360.0,1140.0,360.0,1140.0,0.0,0.0,360.0,1140.0,
Jingtong Railway Museum,菁桐鐵道故事館, 4.1,['Open daily'],['09:00-19:00'],"No. 54, Jingtong St, Pingxi District, New Taipei City, Taiwan 226",0.0,,"For train fans, the Train Museum is very worth visiting. Here we introduce the history of this train line and a lot of information about the site. It attracts many people to visit. It is quite interesting.",https://www.trip.com/travel-guide/attraction/new-taipei-city/jingtong-railway-museum-18119248?curr=USD&locale=en-US,https://ak-d.tripcdn.com/images/fd/tg/g1/M06/CA/B0/CghzflWw3hiASTmXAAV7Brvva2Q788_C_180_240_Q70.webp?proc=source%2ftrip,540.0,1140.0,540.0,1140.0,540.0,1140.0,540.0,1140.0,540.0,1140.0,540.0,1140.0,540.0,1140.0,1.5
Longtan Tourist Pond,龍潭觀光大池, 4.5,['Open daily'],['Open all day'],"No. 100-1, Shanglin Vil., Longtan Township, Longtan District, Taoyuan 325 Taiwan",0.0,,"Taoyuan Longtan: Longtan Dachi will reopen in 2022, stroll the slanted suspension bridge, water bank around the lake trail. The car parked in the Nantian Palace parking lot, free for the first hour, and 20 yuan per hour after that, which is very cost-effective.",https://www.trip.com/travel-guide/attraction/taoyuan/longtan-tourist-pond-18043104?curr=USD&locale=en-US,https://ak-d.tripcdn.com/images/0ww0m120009rl86ouA516_C_180_240_Q70.webp?proc=source%2ftrip,0.0,1440.0,0.0,1440.0,0.0,1440.0,0.0,1440.0,0.0,1440.0,0.0,1440.0,0.0,1440.0,1.5
Futian Garden Farm,富田花園農場, 5,['Open daily'],['09:00-18:00'],桃園市大溪鎮福安裡埤尾20-1號,0.0,,"There are not only pigs, horses and sheep, all kinds of animals, there are many brands to take pictures, there are also many cute cats! But be careful when touching animals, because they may be bitten! Tickets can be consumed in the park for 60, and you can change the carrots! Feed the animals to eat.",https://www.trip.com/travel-guide/attraction/taoyuan/futian-garden-farm-50657146?curr=USD&locale=en-US,https://ak-d.tripcdn.com/images/0ww5a12000chlco40C694_C_180_240_Q70.webp?proc=source%2ftrip,540.0,1080.0,540.0,1080.0,540.0,1080.0,540.0,1080.0,540.0,1080.0,540.0,1080.0,540.0,1080.0,
Keelung Zhengbin old Fishermen's Association Building,基隆正濱舊漁會大樓, 5,,,"No. 391號, Zhongzheng Rd, Zhongzheng District, Keelung City, Taiwan 202",0.0,,"(Business hours are inaccurate) Come for a walk in zhengbin port at night, get another atmosphere and beautiful photos.",https://www.trip.com/travel-guide/attraction/keelung/keelung-zhengbin-old-fishermen-s-association-building-137628612?curr=USD&locale=en-US,https://ak-d.tripcdn.com/images/fd/tg/g1/M08/FC/24/CghzflW7IACAHgzUAAAvGcMqieg905_C_180_240_Q70.webp?proc=source%2ftrip,,,,,,,,,,,,,,,
Nuandong Valley,拉波波村, 4.5,,,"No. 221, Dongshi St, Nuannuan District, Keelung City, Taiwan 205",0.0,,"(Business hours are inaccurate) The scenery along the way is beautiful, there are mountains and water, so this camping has a different experience. I came to the canyon trail and found that there is actually a lot of beautiful background here. The whole back and forth is about 40 minutes. Let you have basic sports to winter. Will sweat here, don't be wrong Over the scorpion",https://www.trip.com/travel-guide/attraction/keelung/nuandong-valley-87605?curr=USD&locale=en-US,https://ak-d.tripcdn.com/images/0100a120008ebr5rvFE7D_C_180_240_Q70.webp?proc=source%2ftrip,,,,,,,,,,,,,,,1.0
Scenic Wufongci,五峰旗風景區, 4.5,['Open daily'],['Open all day'],"262, Taiwan, Yilan County, Jiaoxi Township, No. 6, Lane 81, Wufeng Road",0.0,,"Very close to the Jiaoxi Hot Spring District, there are grasslands, waterfalls, and streams in the scenic area suitable for the whole family to take a leisure walk together. In the direction leading to the waterfall, you will pass the Church of the Virgin Mary. The scenery on the mountainside is very spectacular. If the weather is good, you can see the entire Jiaoxi city from the mountain.",https://www.trip.com/travel-guide/attraction/yilan/scenic-wufongci-10758507?curr=USD&locale=en-US,https://ak-d.tripcdn.com/images/100g0a0000004wwrnC0C3_C_180_240_Q70.webp?proc=source%2ftrip,0.0,1440.0,0.0,1440.0,0.0,1440.0,0.0,1440.0,0.0,1440.0,0.0,1440.0,0.0,1440.0,1.5
Teapot Mountain Trail,無耳茶壺山登山步道, 4.8,['Open daily'],['Open all day'],"Wuer Teapot Mountain, Ruifang District, New Taipei City",0.0,,"No ear teapot mountain, the first peak of Keelung! The place that people who climb the mountain love is very much, and the scenery along the road is refreshing! Fortunately, I saw the cloud waterfall on a day, there is no regret!",https://www.trip.com/travel-guide/attraction/new-taipei-city/teapot-mountain-trail-24342045?curr=USD&locale=en-US,https://ak-d.tripcdn.com/images/1A0bhk11517azjepsC6F2_C_180_240_Q70.webp?proc=source%2ftrip,0.0,1440.0,0.0,1440.0,0.0,1440.0,0.0,1440.0,0.0,1440.0,0.0,1440.0,0.0,1440.0,
Waziwei Nature Area,挖子尾自然保留區, 4.7,,,"Museum Rd., Bali Dist., New Taipei, Taiwan",0.0,,"(Business hours are inaccurate) The area of the digging Ziwei Nature Reserve is not large, similar to a large city park. The facilities in the reserve are very good and the natural landscape is very beautiful, and there are many small animals in the reserve.",https://www.trip.com/travel-guide/attraction/new-taipei-city/waziwei-nature-area-23034141?curr=USD&locale=en-US,https://ak-d.tripcdn.com/images/100c15000000xnri54CFD_C_180_240_Q70.webp?proc=source%2ftrip,,,,,,,,,,,,,,,2.5
Linmei Shipan Trail,林美石磐步道, 4.5,['Open daily'],['Open all day'],"262 Linmei Village, Yilan County, Taiwan",0.0,,"In addition to the waterfall landscape, there are many plants and butterflies in the Linmei Shiqi trail. Walk along the way and take pictures. You will find that the green scenery is really super chill and super soothing!",https://www.trip.com/travel-guide/attraction/yilan/linmei-shipan-trail-13480539?curr=USD&locale=en-US,https://ak-d.tripcdn.com/images/0ww01120009rkugefBFEE_C_180_240_Q70.webp?proc=source%2ftrip,0.0,1440.0,0.0,1440.0,0.0,1440.0,0.0,1440.0,0.0,1440.0,0.0,1440.0,0.0,1440.0,1.5
Brick Ark Museum,積木博物館 展區整修免費入館/ 優惠DIY活動商品鋪 Under Renovation/ Gift Shop Open, 4.8,['Open daily'],['10:00-17:00'],"No. 2, Xianzheng North Road, Yilan City, Yilan County, Taiwan 260",0.0,,"The ""Building Block Museum"" located in the center of Yilan is small in size but has more than a million blocks and more than a thousand pieces of the collection. Usually, hundreds of masters at home and abroad are displayed. Lego works that are appreciated by the elegant and popular customs are a good place for parent-child activities. ～",https://www.trip.com/travel-guide/attraction/yilan/brick-ark-museum-39889249?curr=USD&locale=en-US,https://ak-d.tripcdn.com/images/0100b12000dd4awrf216C_C_180_240_Q70.webp?proc=source%2ftrip,600.0,1020.0,600.0,1020.0,600.0,1020.0,600.0,1020.0,600.0,1020.0,600.0,1020.0,600.0,1020.0,2.5
Keelung Chenghuang Temple,基隆護國城隍廟, 4.6,['Open daily'],['7:30-19:30'],"No. 7號, Zhongyi Rd, Ren’ai District, Keelung City, Taiwan 200",0.0,,"The Chenghuang Temple is very beautiful, especially the stone carvings in the temple are impressive. The temple we saw in Quanzhou, Fujian, is very borrowed, and it is also a place where the incense is very strong. You can see the local piety of religion.",https://www.trip.com/travel-guide/attraction/keelung/keelung-chenghuang-temple-24650576?curr=USD&locale=en-US,https://ak-d.tripcdn.com/images/10091g000001ha12d726E_C_180_240_Q70.webp?proc=source%2ftrip,450.0,1170.0,450.0,1170.0,450.0,1170.0,450.0,1170.0,450.0,1170.0,450.0,1170.0,450.0,1170.0,
Tonghou River,桶後溪, 4.7,,,"233 Xiaoyi Industrial Road, Wulai District, New Taipei City, Taiwan",0.0,,"(Business hours are inaccurate) The back stream of the bucket is a very beautiful place. The natural landscape here is particularly beautiful, with mountains and waters, beautiful mountains and clear waters, and the air is very fresh. The trees along the way are shaded, and the birds and flowers are particularly pleasant.",https://www.trip.com/travel-guide/attraction/new-taipei-city/tonghou-river-13471295?curr=USD&locale=en-US,https://ak-d.tripcdn.com/images/01016120008f1s6c84ADC_C_180_240_Q70.webp?proc=source%2ftrip,,,,,,,,,,,,,,,1.5
Jhuwei Beach,竹圍海水浴場,,['Open daily'],['Open all day'],"Zhuwei, Dayuan Township, Taoyuan, Taiwan",0.0,,,https://www.trip.com/travel-guide/attraction/taoyuan/jhuwei-beach-58312736?curr=USD&locale=en-US,https://ak-d.tripcdn.com/images/0ww0x12000955u992D8F9_C_180_240_Q70.webp?proc=source%2ftrip,0.0,1440.0,0.0,1440.0,0.0,1440.0,0.0,1440.0,0.0,1440.0,0.0,1440.0,0.0,1440.0,
Fushan Botanical Garden,福山植物園, 4.5,"['Monday,Wednesday-Sunday']",['9:00-15:00'],"Yuanshan Township, Yilan County, Taiwan",0.0,,"This is to apply; passing through Lushan Road plus cold weather; but when arriving, I feel a fairyland on earth; all the staff are divided into natural. trees. forests. living four areas; walk in and see all trees; each has a notice in front; all look really beautiful; animals walk back and forth from time to time in the mountains; Maybe it’s cold and raining, so I didn’t see a lot; but it’s worth seeing this scenery! ! Especially the lake plus the pine; it’s really beautiful! ! The overall feeling is really slow; the whole area is about2-3 hours after walking; it’s all flat, so you can walk slowly and take pictures! ! It would be great if it didn’t rain! !",https://www.trip.com/travel-guide/attraction/yilan/fushan-botanical-garden-24649722?curr=USD&locale=en-US,https://ak-d.tripcdn.com/images/0106k12000a50ud831931_C_180_240_Q70.webp?proc=source%2ftrip,540.0,900.0,0.0,0.0,540.0,900.0,540.0,900.0,540.0,900.0,540.0,900.0,540.0,900.0,10.0
Guihou Crab Theme Park,龜吼螃蟹主題公園, 4,['Open daily'],['Open all day'],"No. 2號, Yuao Rd, Wanli District, New Taipei City, Taiwan 207",0.0,,"Not far from here, the turtle roar platform can watch the sunrise. There are not many people but photography enthusiasts will gather here and wait for the sunrise to take pictures of the beautiful scenery! There is a small pavilion next to it where you can also rest and have a picnic.",https://www.trip.com/travel-guide/attraction/new-taipei-city/guihou-crab-theme-park-138887439?curr=USD&locale=en-US,https://ak-d.tripcdn.com/images/fd/tg/g2/M02/C5/07/Cghzf1W7H_mAOouUAAA0-J5t66I153_C_180_240_Q70.webp?proc=source%2ftrip,0.0,1440.0,0.0,1440.0,0.0,1440.0,0.0,1440.0,0.0,1440.0,0.0,1440.0,0.0,1440.0,
Northwest Coast Scenic Area (Waiao),東北角暨宜蘭海岸國家風景區管理處, 4.4,['Monday-Friday'],['8:30-17:30'],"No. 36, Xinglong St, Gongliao District, New Taipei City, Taiwan 228",0.0,,"Recently, the net red cafe - Tingtao Café. Try to climb the coastal trail, look down high, the cafe converted from the old military barracks, have a cool bubble drink. Awesome",https://www.trip.com/travel-guide/attraction/new-taipei-city/northwest-coast-scenic-area-87621?curr=USD&locale=en-US,https://ak-d.tripcdn.com/images/100k0r000000h4gr9512D_C_180_240_Q70.webp?proc=source%2ftrip,510.0,1050.0,510.0,1050.0,510.0,1050.0,510.0,1050.0,510.0,1050.0,0.0,0.0,0.0,0.0,2.0
Dongshan River Water Park,冬山河親水公園, 4.6,['Open daily'],['8:00-22:00'],"No. 2, Section 2, Qinhe Rd, Wujie Township, Yilan County, Taiwan 268",0.0,,"Very suitable~ Children come to play in a hydrophilic park, the scenery in the park is still OK, the Dongshan River is relatively wide, there are many projects suitable for children to play, of course, the stimulation is relatively lacking",https://www.trip.com/travel-guide/attraction/yilan/dongshan-river-water-park-10520723?curr=USD&locale=en-US,https://ak-d.tripcdn.com/images/35010t000000inwbh2F28_C_180_240_Q70.webp?proc=source%2ftrip,480.0,1320.0,480.0,1320.0,480.0,1320.0,480.0,1320.0,480.0,1320.0,480.0,1320.0,480.0,1320.0,2.0
E-Long Goat Farm,宜農牧場, 4.1,['Open daily'],['10:00-17:30'],"No. 17, Lane 239, Changchun Road, Kelin Village, Dongshan Township, Yilan County",0.0,,"Yilan's best attraction ""Yinong Ranch"" is here! No way, Yinong Ranch is too fun and too interesting. I saw a lot of cute animals. It was super fun to feed the pigs and drink ㄋㄟㄋㄟ, and the rabbits were all pushed! Come on a relaxing trip to the ranch during the holiday~～",https://www.trip.com/travel-guide/attraction/yilan/e-long-goat-farm-22865292?curr=USD&locale=en-US,https://ak-d.tripcdn.com/images/0ww1m120009558oeuBEC2_C_180_240_Q70.webp?proc=source%2ftrip,600.0,1050.0,600.0,1050.0,600.0,1050.0,600.0,1050.0,600.0,1050.0,600.0,1050.0,600.0,1050.0,
xing long si,興隆寺, 5,['Open daily'],['09:00-17:00'],201台灣基隆市信義區壽山路8號,0.0,,"Xinglong Temple is located halfway up the mountain in Zhongzheng Park in Keelung City, founded by Yu Wei and Jushi. It was founded in the 1950s and 1960s as a Keelung Buddhist library, and many fifth-grade Keelung people like to read here. Later, the monks of the Lingquan Temple of Yuemei Mountain were presided over by the master of the repair, not only the interior was fully renovated, but also the interior was fully renovated, and the name was changed to ""Xinglong Temple"", which was a branch of the Lingquan Temple of Yuemei Mountain. In the early years, the Buddhist library had a large number of books in Japan. After the renovation, Chinese books became large, and the books of the Dazang Sutra and Buddha Light series were on the shelves. The Master Wuzhi said that although the number is not as large as other Buddhist groups, the temple is spacious and elegant, and the windows are bright and clean. There is also a statue of the Tibetan Bodhisattva, which is made in the same mold as Fayan Temple. Everyone who has been here feels a sense of comfort and stability. I look forward to the library being able to flood in again, especially for young people in the area to recognize this valuable historical asset.",https://www.trip.com/travel-guide/attraction/keelung/city-98622649?curr=USD&locale=en-US,https://ak-d.tripcdn.com/images/0100s1200084jd3r829D1_C_180_240_Q70.webp?proc=source%2ftrip,540.0,1020.0,540.0,1020.0,540.0,1020.0,540.0,1020.0,540.0,1020.0,540.0,1020.0,540.0,1020.0,
Jioufen Historical House,九份文史工作室, 4.3,,,"No.207 Jishan Street, Jiufen, Ruifang District, New Taipei City",0.0,,"(Business hours are inaccurate) The Jiufen Wenshi Studio is a very, very small place, if it is not just seen in an old house. It will definitely be missed. There are a lot of information in it to introduce us to the history of Jiufen. Still worth visiting",https://www.trip.com/travel-guide/attraction/new-taipei-city/jioufen-historical-house-24342054?curr=USD&locale=en-US,https://ak-d.tripcdn.com/images/10040y000000lmqb71225_C_180_240_Q70.webp?proc=source%2ftrip,,,,,,,,,,,,,,,1.5
Yu Ren Bo Ji Chang,漁人波止場, 4.5,,,"Guanhai Road, Danshuei District, New Taipei, Taiwan",0.0,,"(Business hours are inaccurate) Generally, tourists who come to the wave stop field rarely find the wave stop field shrine. Although there are many similar shrines in Japan, the area is not very large. There is no need to come here alone to find this shrine, but tourists interested in the Japanese shrine culture are still worth a visit.",https://www.trip.com/travel-guide/attraction/new-taipei-city/yu-ren-bo-ji-chang-23029793?curr=USD&locale=en-US,https://ak-d.tripcdn.com/images/0ww601200094a4not1238_C_180_240_Q70.webp?proc=source%2ftrip,,,,,,,,,,,,,,,
Western-style House of Family Cai,蔡家洋樓, 4,['Open daily'],['Open all day'],"Pingxi District, New Taipei City, Taiwan 226",0.0,,"Red bricks and green trees, intersecting, it can be seen that Mr. was also a family lover, repaired so beautiful.",https://www.trip.com/travel-guide/attraction/new-taipei-city/western-style-house-of-family-cai-24165179?curr=USD&locale=en-US,https://ak-d.tripcdn.com/images/fd/tg/g4/M04/D0/09/CggYHFaDihOAcknRAAF3LDFlL4A692_C_180_240_Q70.webp?proc=source%2ftrip,0.0,1440.0,0.0,1440.0,0.0,1440.0,0.0,1440.0,0.0,1440.0,0.0,1440.0,0.0,1440.0,
花枝遊戲三峽店｜親子樂園｜老街必吃必逛,,,['Open daily'],['9:00-23:30'],23742台灣新北市三峽區文化路27號,0.0,,,https://www.trip.com/travel-guide/attraction/new-taipei-city/city-141843100?curr=USD&locale=en-US,https://ak-d.tripcdn.com/images/fd/tg/g1/M06/FC/24/CghzflW7H_iATdynAAA-FlXAIeA738_C_180_240_Q70.webp?proc=source%2ftrip,540.0,1410.0,540.0,1410.0,540.0,1410.0,540.0,1410.0,540.0,1410.0,540.0,1410.0,540.0,1410.0,
"Pinglin Tea Museum, New Taipei City",坪林茶業博物館, 4.8,"['Monday-Friday', 'Saturday-Sunday']","['9:00-17:00', '9:00-17:30']","232, Taiwan, New Taipei City, Pinglin District, 號",0.0,,"Located in the north 42 county road, the three sections of the Pingshuang Road, the whole road is surrounded by clouds and mist, the camera's photo sounds are coming and going, the mountain roads are winding, driving in the mountains seems to be in a world of wonders, people linger",https://www.trip.com/travel-guide/attraction/new-taipei-city/pinglin-tea-museum-new-taipei-city-23028427?curr=USD&locale=en-US,https://ak-d.tripcdn.com/images/0ww5e12000948cht2F882_C_180_240_Q70.webp?proc=source%2ftrip,540.0,1020.0,540.0,1020.0,540.0,1020.0,540.0,1020.0,540.0,1020.0,540.0,1050.0,540.0,1050.0,0.5
