basicName,subTitleName,rating,openDate,openTime,address,price,label,review,url,img,monOpen,monClose,tuesOpen,tuesClose,wedOpen,wedClose,thursOpen,thursClose,friOpen,friClose,satOpen,satClose,sunOpen,sunClose,recommend,monTime,tuesTime,wedTime,thursTime,friTime,satTime,sunTime
Shandao Temple,善導寺,3.9,['Tuesday-Sunday'],['8:00-17:00'],"No. 23, Section 1, Zhongxiao E Rd, Zhongzheng District, Taipei City, Taiwan 100",0.0,觀光,This is a temple with strong incense in the local area. The local people come here to pray incense during the holidays. They also come to chant Buddha and pray for hanging up. Their colleagues are also a tourist attraction promoted by the local government.,https://www.trip.com/travel-guide/attraction/taipei/shandao-temple-22847507?curr=USD&locale=en-US,https://ak-d.tripcdn.com/images/1me38224x8u5od36m74F2_C_180_240_Q70.webp?proc=source%2ftrip,0.0,0.0,480.0,1020.0,480.0,1020.0,480.0,1020.0,480.0,1020.0,480.0,1020.0,480.0,1020.0,2.5,0,08:00-17:00,08:00-17:00,08:00-17:00,08:00-17:00,08:00-17:00,08:00-17:00
Victoria Garden,維多利亞花園,4.0,,,"105, Taiwan, Taipei City, Songshan District, Section 1, Fuxing S Rd, 49號2樓",0.0,活動,(Business hours are inaccurate) The vegetables are well made. The hamburger is fried mushrooms. The fried mushroom skewers are very fragrant. The environment is really in the garden. It feels a bit Western. The overall satisfaction is quite satisfactory.,https://www.trip.com/travel-guide/attraction/taipei/victoria-garden-51626028?curr=USD&locale=en-US,https://ak-d.tripcdn.com/images/0100o120008ke2ke253B6_C_180_240_Q70.webp?proc=source%2ftrip,562.1621869983372,1244.5464080204335,562.899374755507,1244.5458549678983,562.8994093849674,1244.5475250199336,562.8995090090112,1244.5466187125735,562.8995762859896,1244.7475041838225,561.2004543797319,1243.074793584074,561.2005073182614,1238.2716368226409,2.0,09:00-20:30,09:00-20:30,09:00-20:30,09:00-20:30,09:00-20:30,09:00-20:30,09:00-20:30
Fishes The Shrimp Field,車輪釣蝦場,4.7,['Open daily'],['10:30-04:30'],"No.13, Section 3, Zhishan Road, Shilin District, Taipei, Taiwan",0.0,活動,"Yes, a place worth going, like it, go again next time.",https://www.trip.com/travel-guide/attraction/taipei/fishes-the-shrimp-field-58281493?curr=USD&locale=en-US,https://ak-d.tripcdn.com/images/0ww1212000948rvd9B240_C_180_240_Q70.webp?proc=source%2ftrip,630.0,1710.0,630.0,1710.0,630.0,1710.0,630.0,1710.0,630.0,1710.0,630.0,1710.0,630.0,1710.0,3.5,10:30-28:30,10:30-28:30,10:30-28:30,10:30-28:30,10:30-28:30,10:30-28:30,10:30-28:30
North Gate,北門,4.5,['Open daily'],['Open all day'],"Zhongxiao West Road, Section 1, Tucheng, New Taipei 100 Taiwan",0.0,觀光,"North Gate is an iconic building in Taipei, but it has long lacked the historical sites and landscape maintenance, and the North Gate viaduct (Zhongxiao Bridge Leadway) opened in 1978 is passed close to the North Gate, which makes the North Gate seriously blocked visually. In view of this, the Taipei Municipal Government launched the urban renewal plan ""West Gate Gate Project"" in 2015, which listed the landscape of the North Gate as one of the key projects, demolishing the North Gate viaduct in early 2016, and creating a square-style open space around the city gate. The north gate is expected to become a historical landmark in Taipei.",https://www.trip.com/travel-guide/attraction/taipei/north-gate-22847501?curr=USD&locale=en-US,https://ak-d.tripcdn.com/images/010011200083qzi2o69F3_C_180_240_Q70.webp?proc=source%2ftrip,0.0,1440.0,0.0,1440.0,0.0,1440.0,0.0,1440.0,0.0,1440.0,0.0,1440.0,0.0,1440.0,2.0,00:00-24:00,00:00-24:00,00:00-24:00,00:00-24:00,00:00-24:00,00:00-24:00,00:00-24:00
Shifen Station,十分車站,4.6,['Open daily'],['Open all day'],"Taiwan, New Taipei City, Pingxi District, 226",0.0,觀光,"The station is a stop on the Pingxi Line. The station is not big, and there are various shops and restaurants on both sides of the railway. It is recommended to put sky lights here. The photo effect is very good, and the long rail can be photographed. The waiter will help take pictures, and the attitude is super good. It works well at dusk.",https://www.trip.com/travel-guide/attraction/new-taipei-city/shifen-station-24652734?curr=USD&locale=en-US,https://ak-d.tripcdn.com/images/100u10000000o35ohC795_C_180_240_Q70.webp?proc=source%2ftrip,0.0,1440.0,0.0,1440.0,0.0,1440.0,0.0,1440.0,0.0,1440.0,0.0,1440.0,0.0,1440.0,1.5,00:00-24:00,00:00-24:00,00:00-24:00,00:00-24:00,00:00-24:00,00:00-24:00,00:00-24:00
Luzhou Forbidden City Museum,紫禁城博物館,5.0,['Saturday-Sunday'],['10:00-15:30'],"No.30-1 Desheng Street, Luzhou District, New Taipei, Taiwan",0.0,觀光,"Forbidden City Museum, a good place to take the baby to punch in on weekends.",https://www.trip.com/travel-guide/attraction/new-taipei-city/luzhou-forbidden-city-museum-33079136?curr=USD&locale=en-US,https://ak-d.tripcdn.com/images/0ww1512000946ju5u9BC9_C_180_240_Q70.webp?proc=source%2ftrip,0.0,0.0,0.0,0.0,0.0,0.0,0.0,0.0,0.0,0.0,600.0,930.0,600.0,930.0,1.5,0,0,0,0,0,10:00-15:30,10:00-15:30
Guandu Temple (Kuantu Temple),關渡宮,4.8,['Open daily'],['07:00-21:00'],"No. 360 Zhixing Rd, Beitou District, Taipei, Taiwan",0.0,觀光,"Guandu Palace - commonly known as Guandu Mazu Palace, Guandu Tianhou Palace. Mainly the Taiwan Folk Faith Temple of the Mother of the Heaven, compatible with Buddhism and Taoism, for the oldest and most incense Mazu Temple in North Taiwan, early ""South with Beigang Ma, North related to Duma"" said, respect Beigang Chaotian Palace and Guandu Palace of the Mother of the Heaven. Guandu Palace and Beigang Chaotian Palace, Lugang Tianhou Palace are called ""Taiwan's Three Mazu Temple"". Part 2",https://www.trip.com/travel-guide/attraction/taipei/guandu-temple-92954?curr=USD&locale=en-US,https://ak-d.tripcdn.com/images/0ww3a120009c4440959A4_C_180_240_Q70.webp?proc=source%2ftrip,420.0,1260.0,420.0,1260.0,420.0,1260.0,420.0,1260.0,420.0,1260.0,420.0,1260.0,420.0,1260.0,1.5,07:00-21:00,07:00-21:00,07:00-21:00,07:00-21:00,07:00-21:00,07:00-21:00,07:00-21:00
Lanyang Museum,蘭陽博物館,4.5,"['Monday-Tuesday,Thursday-Sunday']",['09:00-17:00 (Tickets available until:16:30)'],"Lanyang Museum, Section 3, Qingyun Road, Toucheng Township, Yilan County, Taiwan 261",83.7,觀光,A peaceful place to go. Love the architecture of the place. The inner have lots of story of Yilan.,https://www.trip.com/travel-guide/attraction/yilan/lanyang-museum-10520706?curr=USD&locale=en-US,https://ak-d.tripcdn.com/images/010561200085blxvp8C6B_C_180_240_Q70.webp?proc=source%2ftrip,540.0,1020.0,540.0,1020.0,0.0,0.0,540.0,1020.0,540.0,1020.0,540.0,1020.0,540.0,1020.0,1.5,09:00-17:00,09:00-17:00,0,09:00-17:00,09:00-17:00,09:00-17:00,09:00-17:00
"Statue of Liberty, Taipei",台北自由女神,4.2,['Open daily'],['Open all day'],"Section 3, Huanhe N Rd, Shilin District, Taipei City, Taiwan 111",0.0,觀光,The Statue of Liberty in Taipei is much smaller than the Statue of Liberty in New York. It is near the Americas Bridge and not far from our hotel. It is a small statue.,https://www.trip.com/travel-guide/attraction/taipei/statue-of-liberty-taipei-20905970?curr=USD&locale=en-US,https://ak-d.tripcdn.com/images/100r0n000000eg5d7E3D2_C_180_240_Q70.webp?proc=source%2ftrip,0.0,1440.0,0.0,1440.0,0.0,1440.0,0.0,1440.0,0.0,1440.0,0.0,1440.0,0.0,1440.0,2.0,00:00-24:00,00:00-24:00,00:00-24:00,00:00-24:00,00:00-24:00,00:00-24:00,00:00-24:00
Keelung Miaokou Night Market,基隆廟口夜市,4.6,,,"No. 20, Aisi Road, Ren’ai District, Keelung City",0.0,餐飲,"(Business hours are inaccurate) Drink watermelon juice, eat crab soup and oil rice, and eat bubble pink, and teach the local uncle's recommendation (nabana wrap), and love the dog, and mototaka's fried fried rice (Wang ki Tenbura No.16) I took it home and stayed for about １ about an hour and a half, but Mototaka was too good. The mini whiteboard I bought at Mototaka's DAISO, it was too convenient to order (the technique I learned on the last day of my stay in Taiwan)",https://www.trip.com/travel-guide/attraction/keelung/keelung-miaokou-night-market-92962?curr=USD&locale=en-US,https://ak-d.tripcdn.com/images/100n0e000000729zeB2CA_C_180_240_Q70.webp?proc=source%2ftrip,562.2361612717605,1243.8458354833083,562.947745365971,1243.845653731522,562.9471675521589,1243.846941880719,562.9475933189129,1243.8461176389503,562.9473786426619,1244.0787275922362,561.1989655679015,1242.780103600678,561.1989748829956,1238.4675888492604,2.5,09:00-20:30,09:00-20:30,09:00-20:30,09:00-20:30,09:00-20:30,09:00-20:30,09:00-20:30
Guling St. Avant-Garde Theater (Guling),牯嶺街小劇場,4.6,"['Wednesday-Friday', 'Saturday-Sunday']","['12:00-22:00', '10:00-22:00']","No. 2, Lane 5, Guling St, Zhongzheng District, Taipei City, Taiwan 100",0.0,活動,"Guling Street - During the Qing Dynasty, this area was originally part of Longxikouzhuang. At the beginning of the Japanese rule period, the street was officially opened. At that time, there were Japanese-style buildings on the street, and many high-level civil servants lived in the dormitory area of Taiwan's Governor's Mansion. In 1946, officially named Guling Street has been used to this day. After 1945, Japanese in Taiwan were returned to Japan one after another, and some difficult-to-carry books, calligraphy and paintings were placed on stalls for sale, and the ""old book stalls"" gathered. part 3",https://www.trip.com/travel-guide/attraction/taipei/guling-st-avant-garde-theater-13345847?curr=USD&locale=en-US,https://ak-d.tripcdn.com/images/100e0r000000hcrs4AAC7_C_180_240_Q70.webp?proc=source%2ftrip,0.0,0.0,0.0,0.0,720.0,1320.0,720.0,1320.0,720.0,1320.0,600.0,1320.0,600.0,1320.0,2.0,0,0,12:00-22:00,12:00-22:00,12:00-22:00,10:00-22:00,10:00-22:00
Discovery Center of Taipei,台北探索館,4.5,"['Monday-Tuesday,Thursday-Sunday']",['9:00-17:00'],"No. 1號, City Hall Rd, Xinyi District, Taipei City, Taiwan 110",0.0,觀光,"After coming out of 101, I just passed here. I didn't need a ticket to visit. The exploration museum is not very big, but the display is quite good, quite good. There are also many city materials in Taipei to see.",https://www.trip.com/travel-guide/attraction/taipei/discovery-center-of-taipei-10520722?curr=USD&locale=en-US,https://ak-d.tripcdn.com/images/10070h0000008vx4006BC_C_180_240_Q70.webp?proc=source%2ftrip,540.0,1020.0,540.0,1020.0,0.0,0.0,540.0,1020.0,540.0,1020.0,540.0,1020.0,540.0,1020.0,2.0,09:00-17:00,09:00-17:00,0,09:00-17:00,09:00-17:00,09:00-17:00,09:00-17:00
Tamsui River,淡水河,4.7,,,"Xining North Road, New Taipei, Taiwan",0.0,活動,"(Business hours are inaccurate) A walk on the riverbank in the evening of the Mid-Autumn Festival - Enjoy the famous freshwater sunset today in the section of the dock where Dr. Vale hippo is ashore, and the entire river is bathed in beautiful golden light.",https://www.trip.com/travel-guide/attraction/new-taipei-city/tamsui-river-23866567?curr=USD&locale=en-US,https://ak-d.tripcdn.com/images/0100g12000870q5cg02C1_C_180_240_Q70.webp?proc=source%2ftrip,562.1620284580484,1244.6248605542323,562.8860567836471,1244.6245236607429,562.8859634342094,1244.626386427786,562.8861228954111,1244.624955562407,562.8861979474807,1244.7986360478394,561.119692786629,1242.985780682941,561.1197252862761,1238.6150545938058,1.5,09:00-20:30,09:00-20:30,09:00-20:30,09:00-20:30,09:00-20:30,09:00-20:30,09:00-20:30
Wulai Falls,烏來瀑布,4.7,['Open daily'],['Open all day'],"No. 16, Pubu Rd, Wulai District, New Taipei City, Taiwan 233",0.0,活動,"Arrived in Wulai at night, stayed in the soup to eat wild vegetables, and slept beautifully at night. The next day, Wulai Old Street walked, took a small train to Wulai Waterfall, there is a coffee shop next to the waterfall, listen to the waterfall drink coffee to breathe enough oxygen, and fly a small butterfly, too beautiful",https://www.trip.com/travel-guide/attraction/new-taipei-city/wulai-falls-23028119?curr=USD&locale=en-US,https://ak-d.tripcdn.com/images/0106912000a4tccgk0CEE_C_180_240_Q70.webp?proc=source%2ftrip,0.0,1440.0,0.0,1440.0,0.0,1440.0,0.0,1440.0,0.0,1440.0,0.0,1440.0,0.0,1440.0,1.5,00:00-24:00,00:00-24:00,00:00-24:00,00:00-24:00,00:00-24:00,00:00-24:00,00:00-24:00
Taiyuan Asian Puppet Theatre Museum,台原亞洲偶戲博物館,4.2,,,"No. 79-1, Xining N Rd, Datong District, Taipei City, Taiwan 103",0.0,觀光,"(Business hours are inaccurate) The scenery is pleasant, the fun is Hang Seng, and the price is high.",https://www.trip.com/travel-guide/attraction/taipei/taiyuan-asian-puppet-theatre-museum-22846569?curr=USD&locale=en-US,https://ak-d.tripcdn.com/images/0ww1i12000947h8y15546_C_180_240_Q70.webp?proc=source%2ftrip,562.2315284041703,1243.8276068536516,562.9914444741258,1243.8267170897354,562.9910585504333,1243.828120023006,562.9912948621729,1243.8273895080224,562.9911139335348,1244.2092530271225,561.3294495378282,1243.778153031438,561.3294862772608,1238.3626754595102,1.5,09:00-20:30,09:00-20:30,09:00-20:30,09:00-20:30,09:00-20:30,09:00-20:30,09:00-20:30
Yanping Riverside Park,延平河濱公園,4.6,['Open daily'],['Open all day'],"Diwai Rd, Datong District, Taipei City, Taiwan 103",0.0,活動,"Walking on the riverbank in the evening of the fifth day of the new year - today is the section of the Yanping Riverside Park in the freshwater river, seeing the most successful sunset and the beaming orange glow of the year.",https://www.trip.com/travel-guide/attraction/taipei/yanping-riverside-park-56807456?curr=USD&locale=en-US,https://ak-d.tripcdn.com/images/0105u1200098zavq1C9E2_C_180_240_Q70.webp?proc=source%2ftrip,0.0,1440.0,0.0,1440.0,0.0,1440.0,0.0,1440.0,0.0,1440.0,0.0,1440.0,0.0,1440.0,2.0,00:00-24:00,00:00-24:00,00:00-24:00,00:00-24:00,00:00-24:00,00:00-24:00,00:00-24:00
Shilin Cixian Temple,士林慈諴宮,4.5,['Open daily'],['6:00-22:00'],"No.84 Da'nan Road, Shilin District, Taipei, Taiwan",0.0,觀光,"Shilin Ci?? Palace - Also known as Shilin Mazu Temple, formerly known as the Temple of the Queen of Zhilan Street, the main holy mother of heaven, is a temple with two temples, two corridors and two dragon protection plane configuration. Its history dates back to the first year of Qing Jiaqing (1796), and the three ancient temples in Shilin area are the three temples in Ci?? Palace, the old street Shennong Palace and the Zhishanyan Huiji Palace. The only temple building in Taipei that has three exquisite stage stands directly in front of it, and the bluestone mantle in front of the temple extends to the stage, showing the original magnificentness of the temple. Part 2",https://www.trip.com/travel-guide/attraction/taipei/shilin-cixian-temple-22846549?curr=USD&locale=en-US,https://ak-d.tripcdn.com/images/1mh6m2215fpf7n13kD5F0_C_180_240_Q70.webp?proc=source%2ftrip,360.0,1320.0,360.0,1320.0,360.0,1320.0,360.0,1320.0,360.0,1320.0,360.0,1320.0,360.0,1320.0,1.5,06:00-22:00,06:00-22:00,06:00-22:00,06:00-22:00,06:00-22:00,06:00-22:00,06:00-22:00
tai bei biao yan yi shu zhong xin,臺北表演藝術中心,5.0,['Tuesday-Sunday'],['12:00-21:00'],111台北市士林區劍潭路1號,0.0,觀光,"The Taipei Performing Arts Center is a special building with a 1-story underground, 12-story high floor and a novel exterior. The curtain wall system of the main exterior wall of the building consists of S-wave glass, and the exterior walls of the three theaters are made of flat aluminum and arc aluminum. The building contains a 1,500-seat theater, two 800-seat spherical frame and multi-form medium-sized theater, the largest feature is that the three theaters can operate independently. If you need a large performance, you can also combine two of the theaters into a ""super-large theater"" that can accommodate 2550 seats, 65 meters long and 18 meters wide. Part 2",https://www.trip.com/travel-guide/attraction/taipei/city-134056803?curr=USD&locale=en-US,https://ak-d.tripcdn.com/images/0105712000dsl3mg37F55_C_180_240_Q70.webp?proc=source%2ftrip,0.0,0.0,720.0,1260.0,720.0,1260.0,720.0,1260.0,720.0,1260.0,720.0,1260.0,720.0,1260.0,1.5,0,12:00-21:00,12:00-21:00,12:00-21:00,12:00-21:00,12:00-21:00,12:00-21:00
Taipei International Convention Center,台北國際會議中心(TICC),4.4,['Open daily'],['7:30-22:30'],"1 Hsin-Yi Rd., Sec.5, Taipei 11049, Taiwan",0.0,觀光,"It happens to be open to enter, the appearance is not very special, but the decoration inside is still very beautiful, clean and bright space, but there is no exhibition, take two photos and leave, nothing special",https://www.trip.com/travel-guide/attraction/taipei/taipei-international-convention-center-22846550?curr=USD&locale=en-US,https://ak-d.tripcdn.com/images/0105712000a2p8zal1F86_C_180_240_Q70.webp?proc=source%2ftrip,450.0,1350.0,450.0,1350.0,450.0,1350.0,450.0,1350.0,450.0,1350.0,450.0,1350.0,450.0,1350.0,2.0,07:30-22:30,07:30-22:30,07:30-22:30,07:30-22:30,07:30-22:30,07:30-22:30,07:30-22:30
"Museum of the Institute of History and Philology, Academia Sinica",中央研究院歷史語言研究所,4.3,,,"No.130, Section 2, Yanjiuyuan Road, Nangang District, Nangang, Taipei 11529 Taiwan",0.0,觀光,"(Business hours are inaccurate) There are many language masters here, and a lot of knowledge has been learned",https://www.trip.com/travel-guide/attraction/taipei/museum-of-the-institute-of-history-and-philology-academia-sinica-24048443?curr=USD&locale=en-US,https://ak-d.tripcdn.com/images/0ww1f12000chig9r88258_C_180_240_Q70.webp?proc=source%2ftrip,562.214705236413,1243.9216221031777,562.9851339026208,1243.9218530105838,562.9856142199127,1243.920716839304,562.9853843482763,1243.9220288576523,562.9855958383514,1244.3275691402062,561.3006312549702,1243.9344360739617,561.3006156775556,1238.417862452387,1.0,09:00-20:30,09:00-20:30,09:00-20:30,09:00-20:30,09:00-20:30,09:00-20:30,09:00-20:30
Dahu Park,大湖公園,4.8,['Open daily'],['Open all day'],"No.31, Sec. 5, Chenggong Rd., Neihu Dist., Taipei, Taiwan",0.0,活動,"Walking on the riverbank in the evening - Today is the Great Lakes Park, lucky to enjoy the beautiful scenery reflected on the lake by the fire and clouds. Great Lake Park is located on the east side of the Neihu Basin, adjacent to Bailu Mountain, Yaozhi Wuzhi Mountain, Zhongyong Mountain and other areas covering about 13 hectares, famous for Bailu, waterbird and landscape. part 2",https://www.trip.com/travel-guide/attraction/taipei/dahu-park-24341560?curr=USD&locale=en-US,https://ak-d.tripcdn.com/images/100q0v000000jr0sgAE7F_C_180_240_Q70.webp?proc=source%2ftrip,0.0,1440.0,0.0,1440.0,0.0,1440.0,0.0,1440.0,0.0,1440.0,0.0,1440.0,0.0,1440.0,1.5,00:00-24:00,00:00-24:00,00:00-24:00,00:00-24:00,00:00-24:00,00:00-24:00,00:00-24:00
Linji Huguo Temple,臨濟護國禪寺,5.0,['Open daily'],['13:00-17:00;8:30-11:00'],"No. 9號, Yumen St, Zhongshan District, Taipei City, Taiwan 104027",0.0,觀光,"Linji Huguo Temple - Nanshan Huguo Linji Temple, an old town, was built in 1900, and was held in 1912 in the Buddhist style. It is the fundamental Taoist field of Linji Zongmiaoxin Temple in Taiwan. The architectural form of Daxiong Pavilion takes the imitation Song-style Buddhist Temple pattern of Japan Jialan. The roof has a positive ridge. The four ridges and four ridges of the rest of the mountain, the temple tube tiles are engraved with the word ""town"". Li Ganlang said that the largest Japanese-era wooden structure in Taiwan was originally located in the West Benyuan Temple in Wanhua District, but after it was burned by the unknown fire, Linji Huguo Temple later lived up to become the largest building. The temple is dedicated to the three worshippers of Sakya (Sakya Buddha, Wenshu Bodhisattva, Puxian Bodhisattva) part 3",https://www.trip.com/travel-guide/attraction/taipei/linji-huguo-temple-73142238?curr=USD&locale=en-US,https://ak-d.tripcdn.com/images/0ww0c1200094e7bd7273C_C_180_240_Q70.webp?proc=source%2ftrip,780.0,2100.0,780.0,2100.0,780.0,2100.0,780.0,2100.0,780.0,2100.0,780.0,2100.0,780.0,2100.0,2.0,13:00-35:00,13:00-35:00,13:00-35:00,13:00-35:00,13:00-35:00,13:00-35:00,13:00-35:00
Center for Traditional Arts,台灣傳統藝術中心,4.4,['Open daily'],['09:00-18:00'],"No. 201, Section 2, Wubin Road, Wujie Township, Yilan County",120.0,觀光,"The Traditional Art Center is a theme park that introduces Taiwan's traditional culture. The content is quite rich, not only making Yilan proud, but also making Taiwanese understand Taiwan's historical development and relevant literature, and experiencing the blue wisps of the ancient people who pioneered Taiwan, and at the relaxing moment of tourism. You can learn a lot of knowledge, and count it.",https://www.trip.com/travel-guide/attraction/yilan/center-for-traditional-arts-10524265?curr=USD&locale=en-US,https://ak-d.tripcdn.com/images/100c0l000000cvwwa0420_C_180_240_Q70.webp?proc=source%2ftrip,540.0,1080.0,540.0,1080.0,540.0,1080.0,540.0,1080.0,540.0,1080.0,540.0,1080.0,540.0,1080.0,2.0,09:00-18:00,09:00-18:00,09:00-18:00,09:00-18:00,09:00-18:00,09:00-18:00,09:00-18:00
Tamsui Customs Officers' Residence,小白宮 清朝,4.5,"['Monday-Friday', 'Saturday-Sunday']","['9:30-17:00', '9:30-18:00']","No. 15號, Zhenli St, Tamsui District, New Taipei City, Taiwan 251",0.0,觀光,"Former Clearwater Guan Tax Department official residence - also known as the ""Little White House"", built in 1862, has a history of more than 100 years, named after the appearance of the eye-catching Spanish-style white building. Colonial architecture features elevated foundations, verandah (terrace)-like setting around the corner, floor-to-ceiling doors and windows, chimneys, etc.",https://www.trip.com/travel-guide/attraction/new-taipei-city/tamsui-customs-officers-residence-92932?curr=USD&locale=en-US,https://ak-d.tripcdn.com/images/100b0l000000ctaod2476_C_180_240_Q70.webp?proc=source%2ftrip,570.0,1020.0,570.0,1020.0,570.0,1020.0,570.0,1020.0,570.0,1020.0,570.0,1080.0,570.0,1080.0,1.0,09:30-17:00,09:30-17:00,09:30-17:00,09:30-17:00,09:30-17:00,09:30-18:00,09:30-18:00
Beitou Museum,北投文物館,4.5,['Tuesday-Sunday'],['10:00-18:00'],"No.32 Youya Road, Beitou District, Taipei, Taiwan",110.1,觀光,"Beitou Cultural Relic Museum/Founded in the 1920s, the work is exquisite, one of the largest single Japanese-style pure wood buildings in Taiwan. Japanese rule period was a Japanese officer club, once used by the special attack team of the kamikaze, after World War II and became the Ministry of Foreign Affairs Jiashan Guest House, now privately owned, is the exhibition of folk art bone. The tea art museum was built in the 1940s and is small in scale. Its traditional Japanese-style water garden has great architectural artistic value and is a complete complex with the architecture of the cultural relics museum.",https://www.trip.com/travel-guide/attraction/taipei/beitou-museum-22846567?curr=USD&locale=en-US,https://ak-d.tripcdn.com/images/fd/tg/g3/M0A/55/C3/CggYGlY7BiaAaF3uABm0g8ddEwo667_C_180_240_Q70.webp?proc=source%2ftrip,0.0,0.0,600.0,1080.0,600.0,1080.0,600.0,1080.0,600.0,1080.0,600.0,1080.0,600.0,1080.0,1.5,0,10:00-18:00,10:00-18:00,10:00-18:00,10:00-18:00,10:00-18:00,10:00-18:00
NTUH (National Taiwan University Hospital),國立臺灣大學醫學院附設醫院,5.0,['Open daily'],['09:00-17:00'],"No. 7號, Zhongshan S Rd, Zhongzheng District, Taipei City, Taiwan 100",0.0,觀光,"Taida Hospital was founded in 1895, the site was first established in Taidao, Taipei, and in 1898 it was moved to the current site (now known as the West Site or the old building, located at 1 Changde Street) as a wooden building; The tropical building, which was renovated in 1912, was completed in 1921 and is the largest and most modern hospital in Southeast Asia. Due to its long history and beautiful architecture, it was listed as a monument in Taipei City on March 25, 1998.",https://www.trip.com/travel-guide/attraction/taipei/ntuh-134105389?curr=USD&locale=en-US,https://ak-d.tripcdn.com/images/0100v12000dtzkljqE8BC_C_180_240_Q70.webp?proc=source%2ftrip,540.0,1020.0,540.0,1020.0,540.0,1020.0,540.0,1020.0,540.0,1020.0,540.0,1020.0,540.0,1020.0,2.0,09:00-17:00,09:00-17:00,09:00-17:00,09:00-17:00,09:00-17:00,09:00-17:00,09:00-17:00
Yehliu Ocean World,野柳海洋世界,4.5,"['Monday-Friday', 'Saturday-Sunday']","['9:00-17:00', '9:00-17:30']","No.167-3, Kantung Road, Yehliu Village, Wanli District,, New Taipei 207, Taiwan",375.3,觀光,"Yeliu is a very beautiful place. There are invincible sea views, and you can also enjoy very special geographical wonders, attracting a lot of tourists. And the many performances of SeaWorld animals are also wonderful",https://www.trip.com/travel-guide/attraction/new-taipei-city/yehliu-ocean-world-23033894?curr=USD&locale=en-US,https://ak-d.tripcdn.com/images/10060l000000d2zeu8FE5_C_180_240_Q70.webp?proc=source%2ftrip,540.0,1020.0,540.0,1020.0,540.0,1020.0,540.0,1020.0,540.0,1020.0,540.0,1050.0,540.0,1050.0,2.5,09:00-17:00,09:00-17:00,09:00-17:00,09:00-17:00,09:00-17:00,09:00-17:30,09:00-17:30
Keelung Port,基隆內港,4.4,,,"Inner Harbor of Keelung, Taiwan",0.0,活動,"(Business hours are inaccurate) The Keelung City Expo, built with the concept of ""City as the Exhibition Hall"", covers exhibitions, art equipment, market events, wonderful exhibitions, showing the fun of Keelung day and night, and also shows people to see the changes of the city. Part 2",https://www.trip.com/travel-guide/attraction/keelung/keelung-port-87602?curr=USD&locale=en-US,https://ak-d.tripcdn.com/images/100c1f000001gswyu361B_C_180_240_Q70.webp?proc=source%2ftrip,562.1791191722431,1244.4040830299518,562.9094109299642,1244.4050530948095,562.9101064137454,1244.402271087474,562.9098345931692,1244.40496240419,562.9101804865847,1244.5623004007414,561.1708613901027,1242.7113420054686,561.1708321336623,1238.1738820868347,2.5,09:00-20:30,09:00-20:30,09:00-20:30,09:00-20:30,09:00-20:30,09:00-20:30,09:00-20:30
