basicName,subTitleName,rating,openDate,openTime,address,price,label,review,url,img,monOpen,monClose,tuesOpen,tuesClose,wedOpen,wedClose,thursOpen,thursClose,friOpen,friClose,satOpen,satClose,sunOpen,sunClose,recommend,monTime,tuesTime,wedTime,thursTime,friTime,satTime,sunTime
Taipei Sightseeing Bus Hop On Hop Off,台北雙層觀光巴士,4.5,,,"Taipei Station, Taipei City",0,活動,"Especially convenient. Basically covers the main attractions in the city. The child is very excited to sit on the second floor and watch the scenery, which is a special experience. Unlimited number of times, so you can stop and walk for each attraction.",https://www.trip.com/travel-guide/attraction/taipei/taipei-sightseeing-bus-hop-on-hop-off-33764668?curr=USD&locale=en-US,https://ak-d.tripcdn.com/images/1lo6f12000cxyp8bz41D5_C_180_240_Q70.webp?proc=source%2ftrip,597.5825246250572,1233.395648952997,597.5807737391085,1233.409641230179,597.5807750701308,1233.40964136804,597.580776393774,1233.4096415084605,597.5807777092045,1234.2051591770964,594.8181071259615,1243.7951389664754,594.7880144265504,1235.965975941951,10.0,09:30-20:30,09:30-20:30,09:30-20:30,09:30-20:30,09:30-20:30,09:30-20:30,09:30-20:30
Taiwan Science Education Center,台灣科學教育館,4.3,"['Tuesday-Friday', 'Saturday-Sunday']","['09:00-17:00', '09:00-18:00']","No.189 Shishang Road, Shilin District, Taipei 111, Taiwan",86.10000000000001,觀光,"In this area, fruit 3 big wild play, planetarium, children's new paradise, between the buried scorpion...maybe there will be less and less than it. The place is also big, but it may be a wider theme and a little less focused. The impression is from physical science, human genetics, mechanical mechanics, acoustics... Don't count, there are D, you can talk rich, but you have to have children who are really full of words. I think most of the flowers are seen.",https://www.trip.com/travel-guide/attraction/taipei/taiwan-science-education-center-13425894?curr=USD&locale=en-US,https://ak-d.tripcdn.com/images/100t0g0000007ru93F679_C_180_240_Q70.webp?proc=source%2ftrip,0.0,0.0,540.0,1020.0,540.0,1020.0,540.0,1020.0,540.0,1020.0,540.0,1080.0,540.0,1080.0,2.5,0,09:00-17:00,09:00-17:00,09:00-17:00,09:00-17:00,09:00-18:00,09:00-18:00
Taipei Xiahai City God Temple,台北霞海城隍廟,4.4,['Open daily'],['7:00-19:00'],"No.61 First Section Dihua Street, Taipei, Taiwan",0,觀光,"Xiahai City God Temple is really good ∼ The weather today is very good... The crowd is very crowded, not faded due to the epidemic... I happened to meet the ""hands in the palm"" performance that is being ""made"" and the newcomer feedback is attached to the visit process... I wish everyone can find their own other ""half""",https://www.trip.com/travel-guide/attraction/taipei/taipei-xiahai-city-god-temple-10520712?curr=USD&locale=en-US,https://ak-d.tripcdn.com/images/10030j000000a046f52AD_C_180_240_Q70.webp?proc=source%2ftrip,420.0,1140.0,420.0,1140.0,420.0,1140.0,420.0,1140.0,420.0,1140.0,420.0,1140.0,420.0,1140.0,2.0,07:00-19:00,07:00-19:00,07:00-19:00,07:00-19:00,07:00-19:00,07:00-19:00,07:00-19:00
Songshan Airport Observation Deck,松山機場觀景台,4.9,['Open daily'],['9:00-21:00'],"No. 340-9, Dunhua N. Rd., Songshan, Taipei 105 Taiwan",0,觀光,"The three-story hall is the branch venue of the annual fashion week, which can be regarded as representing the trendy spirit of Taiwan. Many Roman columns are in one corner, the area is large and very stylish. Luxury brands basically have everything. The service desk on the basement floor here can directly handle tax refunds, which is particularly convenient. If the amount is not high, you can get the tax refund directly. If the amount is too high, you will get a stamp and go to the airport to pick it up. There are not many airport tax refunders, just scan the machine, and then go to the tax refund counter to get the money. There is a famous Ding Taifeng on the basement floor, but it is still in line at 9 pm. There are still some handwriting on the basement floor, but only the famous micro-hot hills, a small counter. It seems to remember to sell only three kinds.",https://www.trip.com/travel-guide/attraction/taipei/songshan-airport-observation-deck-58376802?curr=USD&locale=en-US,https://ak-d.tripcdn.com/images/1lo5w12000chbrdzk59F5_C_180_240_Q70.webp?proc=source%2ftrip,540.0,1260.0,540.0,1260.0,540.0,1260.0,540.0,1260.0,540.0,1260.0,540.0,1260.0,540.0,1260.0,1.5,09:00-21:00,09:00-21:00,09:00-21:00,09:00-21:00,09:00-21:00,09:00-21:00,09:00-21:00
Beitou Public Hotspring,北投公園親水公園露天溫泉,5.0,['Open daily'],['5:30-7:30;8:00-10:00;10:30-13:00;13:30-16:00;16:30-19:00;19:30-22:00'],"No. 6號, Zhongshan Rd, Beitou District, Taipei City, Taiwan 112",0,活動,"There is a lotus pond in Beitou Park. It is in the early summer season. The cool breeze on the pool is slowly, and the lotus fragrance is full of summer style. part 2",https://www.trip.com/travel-guide/attraction/taipei/beitou-public-hotspring-137304984?curr=USD&locale=en-US,https://ak-d.tripcdn.com/images/100k0l000000culsaCD92_C_180_240_Q70.webp?proc=source%2ftrip,330.0,1320.0,330.0,1320.0,330.0,1320.0,330.0,1320.0,330.0,1320.0,330.0,1320.0,330.0,1320.0,2.5,05:30-22:00,05:30-22:00,05:30-22:00,05:30-22:00,05:30-22:00,05:30-22:00,05:30-22:00
Lin An Tai Historical House and Museum,林安泰古厝,4.6,['Tuesday-Sunday'],['9:00-17:00'],"No.5, Binjiang Street, Taipei 10491, Taiwan",0,觀光,"Lin Antai Ancient Temple - also known as Rong Tai Temple, built in the year of Qianlong in the present Da'an District, in 1978 due to the road widening and demolition, for the Ming and Qing Dynasties style of the single-story two-in-one courtyard house, with water-shaped gables, swallow-tailed roof ridge, to sacrifice the ancestors' main hall as the central axis, in front of the nest Sanchuanmen, Outside the front door, the moon eyebrows pool. part 3",https://www.trip.com/travel-guide/attraction/taipei/lin-an-tai-historical-house-and-museum-13425825?curr=USD&locale=en-US,https://ak-d.tripcdn.com/images/0106712000d4jzuwnBEC6_C_180_240_Q70.webp?proc=source%2ftrip,0.0,0.0,540.0,1020.0,540.0,1020.0,540.0,1020.0,540.0,1020.0,540.0,1020.0,540.0,1020.0,2.0,0,09:00-17:00,09:00-17:00,09:00-17:00,09:00-17:00,09:00-17:00,09:00-17:00
Taipei Palace Museum Library and Literature Museum,台北故宮博物院圖書文獻館,4.5,,,"No. 221, Sec 2, Zhi Shan Rd, Shilin District, Taipei City, Taiwan 111",0,觀光,"The Taipei Palace Museum is a place worth staying for a whole day, especially those who like to collect and appreciate, or ancient players, who are excited about history will love it, because there are too many treasures in the Taipei Palace Museum, which is dazzling. Take the Taipei Metro (MRT) Shilin Station Exit 1 and go straight for 100 meters. There are many buses to the Forbidden City. There are designated drinking points. The entrance will be opened for inspection. There is a free gift storage on the right side of the entrance. The whole hall does not provide meals. It takes at least 4 or 5 hours to visit and the hall is closed at 6:30.",https://www.trip.com/travel-guide/attraction/taipei/taipei-palace-museum-library-and-literature-museum-23866568?curr=USD&locale=en-US,https://ak-d.tripcdn.com/images/0103l12000e61itgf520A_C_180_240_Q70.webp?proc=source%2ftrip,597.5767017402737,1233.4429308819667,597.580836635441,1233.409642466646,597.5808415349774,1233.4096425964624,597.580846470246,1233.4096427270022,597.5808514294916,1233.420683524054,594.6878120277078,1239.3851496225298,595.0084736515414,1230.2209250862215,6.0,09:30-20:30,09:30-20:30,09:30-20:30,09:30-20:30,09:30-20:30,09:30-20:30,09:30-20:30
Tamsui Old Street,淡水老街,4.5,['Open daily'],['Open all day'],"No. 1, Zhongzheng Rd, Tamsui District, New Taipei City, Taiwan 251",0,活動,Really nice area for souvenir shopping and some street snacks. Worth a day trip,https://www.trip.com/travel-guide/attraction/new-taipei-city/tamsui-old-street-88672?curr=USD&locale=en-US,https://ak-d.tripcdn.com/images/100k0r000000gtw0qAF30_C_180_240_Q70.webp?proc=source%2ftrip,0.0,1440.0,0.0,1440.0,0.0,1440.0,0.0,1440.0,0.0,1440.0,0.0,1440.0,0.0,1440.0,3.0,00:00-24:00,00:00-24:00,00:00-24:00,00:00-24:00,00:00-24:00,00:00-24:00,00:00-24:00
Shifen Old Street,十分老街,4.6,['Open daily'],['Open all day'],"Pingxi District, New Taipei City, Taiwan 226",0,活動,we booked a one day trip covering 3 places in a day. this is the last destination during our trip. nice place to visit for short period. bought a nice keychain here. the are few eateries selling local snacks.,https://www.trip.com/travel-guide/attraction/new-taipei-city/shifen-old-street-18119246?curr=USD&locale=en-US,https://ak-d.tripcdn.com/images/100m0r000000hm7ygCAB0_C_180_240_Q70.webp?proc=source%2ftrip,0.0,1440.0,0.0,1440.0,0.0,1440.0,0.0,1440.0,0.0,1440.0,0.0,1440.0,0.0,1440.0,1.5,00:00-24:00,00:00-24:00,00:00-24:00,00:00-24:00,00:00-24:00,00:00-24:00,00:00-24:00
Zhuzihu,竹子湖,4.6,['Open daily'],['Open all day'],"Beitou District, Taipei City, Taiwan 112",0,觀光,"The whole tree is yellow and the golden maple is yellow, the leaves are beginning to turn red, the mango flowers are blooming along the side of the creek, and the bamboo lake after the winter is set up. Under the warm winter sun, it is already a bleak atmosphere in late autumn. part 2",https://www.trip.com/travel-guide/attraction/taipei/zhuzihu-96065?curr=USD&locale=en-US,https://ak-d.tripcdn.com/images/100b1f000001gsm6lC5C0_C_180_240_Q70.webp?proc=source%2ftrip,0.0,1440.0,0.0,1440.0,0.0,1440.0,0.0,1440.0,0.0,1440.0,0.0,1440.0,0.0,1440.0,2.0,00:00-24:00,00:00-24:00,00:00-24:00,00:00-24:00,00:00-24:00,00:00-24:00,00:00-24:00
Xpark Aquarium,Xpark 水族館,4.7,"['Saturday', 'Monday-Friday,Sunday']","['10:00-20:00 (Latest entry time:19:00)', '10:00-18:00 (Latest entry time:17:00)']",320桃園市中壢區春德路105號,549.3,活動,"As a foreigner, I enjoyed spending time here. The place looks so pretty, and the fish here are awesome, especially the jellyfish.",https://www.trip.com/travel-guide/attraction/taoyuan/xpark-aquarium-133903160?curr=USD&locale=en-US,https://ak-d.tripcdn.com/images/10021f000001gxbp06CDB_C_180_240_Q70.webp?proc=source%2ftrip,600.0,1080.0,600.0,1080.0,600.0,1080.0,600.0,1080.0,600.0,1080.0,600.0,1200.0,600.0,1080.0,2.5,10:00-18:00,10:00-18:00,10:00-18:00,10:00-18:00,10:00-18:00,10:00-20:00,10:00-18:00
Formosa Express,環島之星-迪士尼列車,4.6,,,"No. 3, Beiping West Road, Zhongzheng District, Taipei City (EZTravel Taipei Station Store - Taipei Train Station Hall, near the North Third Gate and the West First Gate)",631.8,活動,"I like it very much. The facilities in the car are good, the windows are big enough, the scenery along the way is very interesting, the air-conditioning is cool, the front and back rows can sit together, the conversation is convenient, the travel is convenient, the fruit, the drink, very easy to play, suitable for middle-aged people and the elderly to travel, it is worth recommending!",https://www.trip.com/travel-guide/attraction/taipei/formosa-express-10559351?curr=USD&locale=en-US,https://ak-d.tripcdn.com/images/0102m12000dq97icnCC3B_C_180_240_Q70.webp?proc=source%2ftrip,597.5781246807543,1233.4324178274717,597.5809479726719,1233.409628421848,597.5809549893575,1233.409627996116,597.5809620438793,1233.4096275704735,597.5809691221945,1233.1871818862585,594.7111642865036,1238.039849421465,594.971290397912,1228.4467329081738,2.5,09:30-20:30,09:30-20:30,09:30-20:30,09:30-20:30,09:30-20:30,09:30-20:30,09:30-20:00
Shin Kong Life Tower,新光人壽保險摩天大樓,4.1,,,"66 Chunghsiao West Road | Zhongzheng, Taipei, Taiwan",0,觀光,"The insurance building is of course nothing to visit, but we are coming to Xinguang Department Store to buy things, Taiwan Xinguang Department Store we still like, the service is the same as the Japanese department store, the brand is more, the price is much cheaper than the same model in the mainland.",https://www.trip.com/travel-guide/attraction/taipei/shin-kong-life-tower-22846586?curr=USD&locale=en-US,https://ak-d.tripcdn.com/images/0102x12000eb2ei3pE371_C_180_240_Q70.webp?proc=source%2ftrip,597.5765019029931,1233.441052725563,597.5804140951815,1233.409644240154,597.5804071209424,1233.4096444532322,597.5804000977398,1233.4096446658846,597.5803930416577,1232.8077557939866,594.6475290660128,1235.9102150117865,595.1739839657956,1225.6625970240743,1.5,09:30-20:30,09:30-20:30,09:30-20:30,09:30-20:30,09:30-20:30,09:30-20:30,09:30-20:00
Dalongdong Bao An Temple,大龍峒保安宮,4.6,['Open daily'],['06:30-21:00'],"No.61 Hami Street, Datong, Taipei 103 Taiwan",0,觀光,"Congratulations to the Great Pawson for Christmas. The Great Pawson came to the Dalongxu Security Palace for Christmas to visit, pray for good health and peace, and enjoy the beautifully shaped lanterns in the palace.",https://www.trip.com/travel-guide/attraction/taipei/dalongdong-bao-an-temple-85927?curr=USD&locale=en-US,https://ak-d.tripcdn.com/images/0ww6412000945ue63A46A_C_180_240_Q70.webp?proc=source%2ftrip,390.0,1260.0,390.0,1260.0,390.0,1260.0,390.0,1260.0,390.0,1260.0,390.0,1260.0,390.0,1260.0,2.0,06:30-21:00,06:30-21:00,06:30-21:00,06:30-21:00,06:30-21:00,06:30-21:00,06:30-21:00
The Lin Yutang House,林語堂故居,4.5,['Tuesday-Sunday'],['9:00-17:00'],"No.141 Section 2, Yangde Ave, Taipei 111, Taiwan",0,觀光,"Former residence of Lin Yutang - A generation of Chinese masters living in Yangming Mountain in their later years, designed the building where they lived in retirement, adopted the concept of Chinese and Western mergers, with Chinese blue glazed house tiles, Western-style columns with twisted rope lines, and designed the second-level external landscape Yang using the gap of natural terrain Taiwan, both ventilation and lighting, the current house displays the memory of the former owner, which makes people feel ancient and serene.",https://www.trip.com/travel-guide/attraction/taipei/the-lin-yutang-house-85928?curr=USD&locale=en-US,https://ak-d.tripcdn.com/images/0103412000e906u8x1226_C_180_240_Q70.webp?proc=source%2ftrip,0.0,0.0,540.0,1020.0,540.0,1020.0,540.0,1020.0,540.0,1020.0,540.0,1020.0,540.0,1020.0,1.5,0,09:00-17:00,09:00-17:00,09:00-17:00,09:00-17:00,09:00-17:00,09:00-17:00
National Museum of History,台灣歷史博物館,4.7,['Tuesday-Saturday'],['10:00-18:00'],"No.49 Nanhai Road, Zhongzheng District, Taipei 100 Taiwan",0,觀光,"Taiwan History Museum, referred to as the Museum of History, was originally called the Museum of Historical Cultural Relics, the first public museum established after the government of the Republic of China moved to Taiwan, and some of the cultural relics came from the original Henan Museum (now Henan Museum). The original site is the Taiwan Governor's Mansion's property exhibition hall, built in the Japanese period in 1916. After the Shibo Hall moved in, the overall building was gradually converted from the original wooden building to a Chinese palace. After many years of closure, the museum was re-opened for public visits in 2024. part 2",https://www.trip.com/travel-guide/attraction/taipei/national-museum-of-history-80597?curr=USD&locale=en-US,https://ak-d.tripcdn.com/images/100k080000003iti4FD6F_C_180_240_Q70.webp?proc=source%2ftrip,0.0,0.0,600.0,1080.0,600.0,1080.0,600.0,1080.0,600.0,1080.0,600.0,1080.0,0.0,0.0,2.0,0,10:00-18:00,10:00-18:00,10:00-18:00,10:00-18:00,10:00-18:00,0
Heping Island Park,和平島地質公園,4.7,['Open daily'],['08:00-19:00'],"No. 360號, Pingyi Rd, Zhongzheng District, Keelung City, Taiwan 202",98.7,活動,A good place to visit to learn and understand about natural rocks formation. The rocks here are formed naturally by sea water and wind. All rocks will look different overtime and it is up to your imagination on what the rock looks like. There are schedule guided tour here. Have to book a slot at the tourist centre.,https://www.trip.com/travel-guide/attraction/keelung/heping-island-park-87607?curr=USD&locale=en-US,https://ak-d.tripcdn.com/images/10070z000000myos50167_C_180_240_Q70.webp?proc=source%2ftrip,480.0,1140.0,480.0,1140.0,480.0,1140.0,480.0,1140.0,480.0,1140.0,480.0,1140.0,480.0,1140.0,1.5,08:00-19:00,08:00-19:00,08:00-19:00,08:00-19:00,08:00-19:00,08:00-19:00,08:00-19:00
Dajia Riverside Park,大佳河濱公園,4.5,['Open daily'],['Open all day'],"Zhongshan Dist., Taipei, Taiwan",0,活動,"The Dajia Riverside Park section of Keelung River is currently arranged with sunflowers and Persian chrysanthemums for the annual flower sea landscape, and the Dazhiqiao and Yuanshan Hotel in the distance have become the most beautiful background when enjoying flowers and taking pictures.",https://www.trip.com/travel-guide/attraction/taipei/dajia-riverside-park-22846580?curr=USD&locale=en-US,https://ak-d.tripcdn.com/images/100g0h00000094fll6E8C_C_180_240_Q70.webp?proc=source%2ftrip,0.0,1440.0,0.0,1440.0,0.0,1440.0,0.0,1440.0,0.0,1440.0,0.0,1440.0,0.0,1440.0,2.5,00:00-24:00,00:00-24:00,00:00-24:00,00:00-24:00,00:00-24:00,00:00-24:00,00:00-24:00
Pier 5,大稻埕碼頭貨櫃市集,5.0,"['Saturday-Sunday', 'Monday-Friday']","['12:00-22:00', '16:00-22:00']","Bottom of Minsheng West Road, Datong District, Taipei City (Dadaoyu Pier-Inside Water Gate No. 5)",0,活動,"Ren'an Hospital - It was built in Showa 2 years (1927), a hospital opened for locals, and the doctors and grandparents were doctors for three generations. It was widely known as the medical service in Dadaocheng area, and made Ren'an Hospital one of the most important hospitals in Dadaocheng. The facade of the building is baroque carved, and the whole is very stable. The daughter wall above is decorated in a lot of detail. The bottom is to wash stones and some magnet tiles. The building is a shop house building on the second floor, a corner seven-open street house, a corner facade window for three small rooms, and the other windows for two small rooms.",https://www.trip.com/travel-guide/attraction/taipei/pier-5-78410027?curr=USD&locale=en-US,https://ak-d.tripcdn.com/images/10060l000000csz4l8CDE_C_180_240_Q70.webp?proc=source%2ftrip,960.0,1320.0,960.0,1320.0,960.0,1320.0,960.0,1320.0,960.0,1320.0,720.0,1320.0,720.0,1320.0,2.5,16:00-22:00,16:00-22:00,16:00-22:00,16:00-22:00,16:00-22:00,12:00-22:00,12:00-22:00
Tamsui Fisherman's Wharf,漁人碼頭,4.7,['Open daily'],['Open all day'],"Tamsui Fisherman's Wharf, Taiwan",0,活動,"Freshwater Fisherman's Wharf - New Beishifu has been developed into a multi-functional leisure fishing port with beautiful floating piers and a wide port area park, and a boat-shaped bridge across the port area for pedestrians to view. There are also more than 330 metres of wooden plank road on the pier, leaning against the fence to enjoy the view of the Vale Estuary, is a leisurely enjoyment, and the Fisherman's Wharf in the evening is one of the best places to enjoy the sunset.",https://www.trip.com/travel-guide/attraction/new-taipei-city/tamsui-fisherman-s-wharf-10758653?curr=USD&locale=en-US,https://ak-d.tripcdn.com/images/100t0n000000eaz1q716B_C_180_240_Q70.webp?proc=source%2ftrip,0.0,1440.0,0.0,1440.0,0.0,1440.0,0.0,1440.0,0.0,1440.0,0.0,1440.0,0.0,1440.0,2.5,00:00-24:00,00:00-24:00,00:00-24:00,00:00-24:00,00:00-24:00,00:00-24:00,00:00-24:00
Zhongxiao Road,忠孝東路,4.9,,,"Zhongxiao East Road, Daan District, Taipei City",0,活動,It's a shopping paradise. All the of the road can find a lot of shops and restaurants. Good place for shopping.,https://www.trip.com/travel-guide/attraction/taipei/zhongxiao-road-100278?curr=USD&locale=en-US,https://ak-d.tripcdn.com/images/100s1f000001gx701EFF3_C_180_240_Q70.webp?proc=source%2ftrip,597.5718788015562,1233.4824933865789,597.5809628528876,1233.4096227143978,597.5809687017747,1233.409622030974,597.5809746086011,1233.409621347759,597.5809805544627,1233.18769604235,594.6993392209208,1238.056292256268,594.9349798329662,1228.506930615118,2.5,09:30-20:30,09:30-20:30,09:30-20:30,09:30-20:30,09:30-20:30,09:30-20:30,09:30-20:00
Huashan Yiwen Art Gallery,華山藝文特區,4.8,,,"Zhongzheng District, Taipei City, Taiwan 100",0,活動,"Huashan Creative Culture Park, also known as ""Huashan Art and Culture Special Zone Huashan Cultural Park, formerly known as ""Taipei Winery"", is a monument in Taipei City, Taiwan. It was founded in 1914 in the Japanese period. It was originally a wine factory of Fangjiu Co., Ltd., autocratic sake, butterfly orchid, ginseng wine.",https://www.trip.com/travel-guide/attraction/taipei/huashan-yiwen-art-gallery-24650428?curr=USD&locale=en-US,https://ak-d.tripcdn.com/images/1lo3712000e9265ym5A78_C_180_240_Q70.webp?proc=source%2ftrip,597.5853315344115,1233.3731633084703,597.5807459511805,1233.409642468759,597.5807510113847,1233.409642631593,597.5807561228003,1233.4096427948032,597.5807612681645,1233.2014334104997,594.6953073562671,1238.109362259276,594.9456044966709,1228.4915686013414,2.5,09:30-20:30,09:30-20:30,09:30-20:30,09:30-20:30,09:30-20:30,09:30-20:30,09:30-20:00
Window on World Theme Park,小人國主題樂園,4.5,['Open daily'],['09:00-16:30'],"No. 891, Gaoyuan Rd, Longtan District, Taoyuan City, Taiwan 325",1220.1000000000001,活動,"The various models are still Weimiao Weixiao, which is more suitable for children to come and see. Of course, there are actually more opportunities to go abroad now, so it is not very unusual to see this kind of thing, for adults.",https://www.trip.com/travel-guide/attraction/taoyuan/window-on-world-theme-park-88422?curr=USD&locale=en-US,https://ak-d.tripcdn.com/images/100o1f000001gp51dCF0C_C_180_240_Q70.webp?proc=source%2ftrip,540.0,990.0,540.0,990.0,540.0,990.0,540.0,990.0,540.0,990.0,540.0,990.0,540.0,990.0,10.0,09:00-16:30,09:00-16:30,09:00-16:30,09:00-16:30,09:00-16:30,09:00-16:30,09:00-16:30
2-28 Memorial Museum,二二八紀念和平公園,4.4,['Open daily'],['Open all day'],"No. 3, Ketagalan Blvd, Zhongzheng District, Taipei City, Taiwan 100",0,活動,"Not far from the Governor General Building, it is with the Taipei Museum. Because it is possible to take a quiet walk, you can take a leisurely look around for a while.",https://www.trip.com/travel-guide/attraction/taipei/2-28-memorial-museum-85890?curr=USD&locale=en-US,https://ak-d.tripcdn.com/images/1mh2m2215g6hqun74DDBF_C_180_240_Q70.webp?proc=source%2ftrip,0.0,1440.0,0.0,1440.0,0.0,1440.0,0.0,1440.0,0.0,1440.0,0.0,1440.0,0.0,1440.0,2.0,00:00-24:00,00:00-24:00,00:00-24:00,00:00-24:00,00:00-24:00,00:00-24:00,00:00-24:00
Qixing Mountain,七星山步道,4.7,['Open daily'],['Open all day'],"Shichisei Mountain, Beitou District, Taipei City, Taiwan 112",0,活動,"It's terrible, it's very hard to climb, it may be too long without exercise and the physical strength has deteriorated! The scenery is beautiful when I climb up hard, but I am really tired! I didn't expect that the top of the mountain is as crowded as the vegetable market, and I suddenly feel that I am too weak! ??",https://www.trip.com/travel-guide/attraction/taipei/qixing-mountain-13425750?curr=USD&locale=en-US,https://ak-d.tripcdn.com/images/1lo4x12000cf2go110A05_C_180_240_Q70.webp?proc=source%2ftrip,0.0,1440.0,0.0,1440.0,0.0,1440.0,0.0,1440.0,0.0,1440.0,0.0,1440.0,0.0,1440.0,1.5,00:00-24:00,00:00-24:00,00:00-24:00,00:00-24:00,00:00-24:00,00:00-24:00,00:00-24:00
Hsin Tung Yang (Wuchang Branch),武昌街,4.6,,,"Wuchang Street, Ximending Shopping District, Taipei",0,活動,Wuchang Street is a place dominated by old houses. It feels like time and space. The shops on both sides are also traditional. I like this street very much. The local taste is strong.,https://www.trip.com/travel-guide/attraction/taipei/hsin-tung-yang-18700398?curr=USD&locale=en-US,https://ak-d.tripcdn.com/images/fd/tg/g2/M08/2E/37/Cghzf1W2KnmAZl-MADoinL5fsZo596_C_180_240_Q70.webp?proc=source%2ftrip,597.5729731347255,1233.4708860668206,597.5806215704096,1233.4096367723407,597.5806193409592,1233.4096366827994,597.580617087533,1233.4096365931705,597.5806148172636,1233.0503820739807,594.7013268926794,1237.2733426751786,594.9973667384102,1227.4712534310927,1.5,09:30-20:30,09:30-20:30,09:30-20:30,09:30-20:30,09:30-20:30,09:30-20:30,09:30-20:00
Houtong Cat Village,,4.5,['Open daily'],['Open all day'],"Houtong Cat Village, Ruifang District, New Taipei City, Taiwan 224",0,活動,"Cat village with only cats sleeping, a lot of people, recommend to go on weekdays because there will not be many people.",https://www.trip.com/travel-guide/attraction/new-taipei-city/houtong-cat-village-10523113?curr=USD&locale=en-US,https://ak-d.tripcdn.com/images/100w0r000000gvz9d3794_C_180_240_Q70.webp?proc=source%2ftrip,0.0,1440.0,0.0,1440.0,0.0,1440.0,0.0,1440.0,0.0,1440.0,0.0,1440.0,0.0,1440.0,2.0,00:00-24:00,00:00-24:00,00:00-24:00,00:00-24:00,00:00-24:00,00:00-24:00,00:00-24:00
Yangming Shuwu,陽明書屋,4.5,['Open daily'],['9:00-16:30'],"112, Taiwan, Taipei City, Beitou District",0,觀光,"Yangming Bookstore is a villa made by Jiang's couple. Located in a very beautiful place in Yangming Mountain, it is actually not possible to take pictures, so I took pictures around it. It is worth visiting a little attraction.",https://www.trip.com/travel-guide/attraction/taipei/yangming-shuwu-92923?curr=USD&locale=en-US,https://ak-d.tripcdn.com/images/10030q000000goi4a969F_C_180_240_Q70.webp?proc=source%2ftrip,540.0,990.0,540.0,990.0,540.0,990.0,540.0,990.0,540.0,990.0,540.0,990.0,540.0,990.0,2.0,09:00-16:30,09:00-16:30,09:00-16:30,09:00-16:30,09:00-16:30,09:00-16:30,09:00-16:30
